Use Case,Business Rule,Formula Type,Required Columns,Example Formula,Notes
Milestone ID Builder,Combine milestone number property short name and task name into a readable milestone ID,Text Formula,"Walk Milestone Number; Property; Task Name","=IF(ISBLANK([Walk Milestone Number]@row), """", [Walk Milestone Number]@row + "" - "" + LEFT(Property@row, FIND("" "", Property@row) - 1) + "" "" + [Task Name]@row)","Useful for building unique schedule task labels."
Schedule Moved in Workdays,Calculate how many workdays a milestone moved between original and new schedule dates,Date Formula,"Original Schedule (Date); New Schedule (Date)","=IF(OR(ISBLANK([Original Schedule (Date)]@row), ISBLANK([New Schedule (Date)]@row)), """", IF([New Schedule (Date)]@row >= [Original Schedule (Date)]@row, NETDAYS([Original Schedule (Date)]@row, [New Schedule (Date)]@row) - 1, -(NETDAYS([New Schedule (Date)]@row, [Original Schedule (Date)]@row) - 1)))","Positive values indicate delay; negative values indicate acceleration."
RIO Checkbox Logic,Check a box when a schedule milestone has a matching RIO item in another sheet,Cross-Sheet Formula,"Milestone ID; RIO","=IF(COUNTIF({RIO Milestone ID}, [Milestone ID]@row) > 0, 1, 0)","Requires a cross-sheet reference to the RIO milestone ID column."
RIO ID Lookup,Return the Risk ID from the RIO log when the milestone ID matches,Cross-Sheet Formula,"RIO; Milestone ID; RIO ID","=IF(RIO@row = 1, INDEX({RIO Risk ID}, MATCH([Milestone ID]@row, {RIO Milestone ID}, 0)), """")","Useful for linking schedule rows back to risk issue or opportunity records."
Kickoff Total Count,Count all rows in another sheet that contain kickoff hold checkboxes,Summary Formula,"***Hold Kick-off","=COUNT({Hold Kick-off})","Counts total checkbox/star values in the referenced column."
Kickoff Complete Count,Count only checked/starred kickoff hold items from another sheet,Summary Formula,"***Hold Kick-off","=COUNTIF({Hold Kick-off}, 1)","For checkbox or star columns, checked usually evaluates as 1."
Property Name Shortener,Return special short property names for known exceptions and otherwise use the first word,Text Formula,"Property","=IF(Property@row = ""Waterstone at Big Creek"", ""Waterstone Big"", IF(Property@row = ""St. James at Goose Creek"", ""St. James"", LEFT(Property@row, FIND("" "", Property@row) - 1)))","Good example of nested IF logic with property-name exceptions."
Month Sort Helper,Create a sortable month number so October November and December appear after earlier months,Text/Number Formula,"First Month Budgeted","=IF([First Month Budgeted]@row = ""January"", 1, IF([First Month Budgeted]@row = ""February"", 2, IF([First Month Budgeted]@row = ""March"", 3, IF([First Month Budgeted]@row = ""April"", 4, IF([First Month Budgeted]@row = ""May"", 5, IF([First Month Budgeted]@row = ""June"", 6, IF([First Month Budgeted]@row = ""July"", 7, IF([First Month Budgeted]@row = ""August"", 8, IF([First Month Budgeted]@row = ""September"", 9, IF([First Month Budgeted]@row = ""October"", 10, IF([First Month Budgeted]@row = ""November"", 11, IF([First Month Budgeted]@row = ""December"", 12, """"))))))))))))","Helps Smartsheet reports sort months in calendar order instead of alphabetically."
